{
  "kind": "revision",
  "schemaVersion": "1.0.0",
  "assetId": "enemy-mob-32-runehide-tortoise",
  "id": "r001",
  "parentRevisionId": null,
  "createdAt": "2026-08-02T01:26:22.000Z",
  "request": "Create an enemy-mob-32 sprite named \"Runehide Tortoise\".\n\nCreative brief\nName: Runehide Tortoise\nCollection: Arcane Menagerie. Wild creatures altered by concentrated magic, with crystalline anatomy, runes, echoes, orbiting objects, and unusual projectile behavior.\nCore concept: A defensive rune caster that activates different shell quadrants in sequence.\nBody and silhouette: Broad low tortoise with a square-edged shell, thick legs, and a compact beaked head.\nSignature features: Four large shell runes, glowing shell seams, and crystal brow plate.\nPalette and materials: Slate blue, muted gold, cream stone, and luminous violet.\nMovement personality: Slow, ancient, and perfectly methodical.\nAttack concept: Illuminates one shell quadrant at a time before firing a fan of rune bolts from the corresponding side.\nDirectional details: The lower-left shell rune is incomplete.\nAvoid: Ordinary turtle, microscopic writing, circular shell without readable quadrants.",
  "category": {
    "id": "enemy-mob-32",
    "version": "0.1.0"
  },
  "style": {
    "id": "assembler-inspired-v2",
    "version": "0.1.0"
  },
  "producer": {
    "application": "Antigravity with Aseprite Pro MCP",
    "model": "Gemini 3.6 High",
    "sessionId": null
  },
  "artifacts": {
    "source": {
      "path": "revisions/r001/source.aseprite",
      "sha256": "288d3f8d2b221b9a2f7fc7a7b5e07177e08ca3ce7ebddc2bc3ea7042b8a72162"
    },
    "sheet": {
      "path": "revisions/r001/sheet.png",
      "sha256": "53db7df6f1b87109fdbed26d9d28355b5eaf7fefdd86bd2cccb7e7a9eb81e5fa"
    },
    "thumbnail": {
      "path": "revisions/r001/thumbnail.png",
      "sha256": "9fb0ae5e2a10ca97916ad761a4ad2eae3400a5366b413b084e67735d976eb9ee"
    }
  },
  "sheet": {
    "cellWidth": 32,
    "cellHeight": 32,
    "columns": 10,
    "rows": 4,
    "width": 320,
    "height": 128
  },
  "directions": [
    "down",
    "left",
    "right",
    "up"
  ],
  "animations": [
    {
      "id": "idle",
      "startColumn": 0,
      "frames": 2,
      "durationMs": 400,
      "playback": "loop"
    },
    {
      "id": "walk",
      "startColumn": 2,
      "frames": 4,
      "durationMs": 150,
      "playback": "loop"
    },
    {
      "id": "attack",
      "startColumn": 6,
      "frames": 4,
      "durationMs": 120,
      "playback": "once"
    }
  ],
  "validationReportPath": "revisions/r001/validation.json",
  "batchId": null
}
