{
  "kind": "revision",
  "schemaVersion": "1.0.0",
  "assetId": "enemy-mob-32-blackmane-warg",
  "id": "r001",
  "parentRevisionId": null,
  "createdAt": "2026-08-02T21:40:00.000Z",
  "request": "Read and follow the project documentation.\n\nPromptinator entry ID: prompt-0280-blackmane-warg\nPrompt formula: structured-v2\nRequired style profile: assembler-inspired-v2@0.1.0\nRequired style guide: styles/assembler-inspired-v2/STYLE_GUIDE.md\n\nCreate an enemy-mob-32 sprite named \"Blackmane Warg\".\n\n## Creative brief\n\n- Collection: Wildland Beasts. Classic MMO wilderness enemies: wolves, boars, bears, stags, hawks, cougars, rams, crocodiles, badgers, and wargs.\n- Core concept: A stronger wolf-like enemy that leads lesser wilderness predators.\n- Body and silhouette: Large lean canine, broad chest, raised black mane, and heavy jaw.\n- Signature features: Black mane, iron tooth caps, and battle-scarred muzzle.\n- Palette and materials: Dark gray, black, dull iron, and muted brown.\n- Movement personality: Commanding, aggressive, and tactically patient.\n- Attack concept: Howls to make nearby beasts reposition, then charges while firing two converging fang-shaped projectile streams.\n- Directional details: The muzzle scar sits on the right, and the mane rises higher on the left.\n- Avoid: Demonic hellhound, giant raid boss, saddle or rider equipment.\n\n## Interpretation rules\n\n- Left and right refer to the creature's own anatomical sides and must remain consistent in every direction.\n- Treat gameplay effects as motion intent: make the attack readable through body posing, and use the effects layer only where the category contract allows.\n- Hard-alpha and style-contract rules override words such as translucent, glowing, soft, or transparent in the creative brief.\n- Before drawing, choose and state one controlled body plan from the required style guide.\n- Build and inspect the four idle directions under one camera and ground plane before expanding the animation timeline.\n- Use only the required style profile's master palette and contour rule.\n- Use a recognition budget of exactly one dominant silhouette anchor plus one secondary identifying feature; the dominant anchor must remain recognizable at native 1x in all four idle directions.\n- Thin, spectral, floating, or winged subjects still need a solid readable center mass; wings and trailing effects remain secondary to it.\n- Keep a humanoid's key weapon or tool visibly separated from the torso in front and back views. For plant or construct concepts, separate the head or core from its supports instead of merging everything into one chunky mass.\n- Do not let a tiny face, eye, or detail carry the whole concept. Before timeline expansion, verify the subject, defining feature, and head or focal cluster all read at 1x.\n- Derive prop visibility per row before drawing: facing down places the creature's left side on the viewer's right; facing up places it on the viewer's left; the left-facing profile shows the creature's own left flank; the right-facing profile shows its right flank. State which asymmetric props are visible in each of the four rows and keep far-flank props hidden.\n- State each row's on-screen attack direction before animating: thrown or projected effects travel toward that row's facing (down toward the cell bottom, up toward the top, left and right toward their edges), stay at least 2 pixels inside every cell edge, and resolve into a recovery pose rather than freezing mid-flight.\n- Before drawing, open and study every promoted example sheet listed in styles/assembler-inspired-v2/examples.json at native 1x and nearest-neighbor 4x; match their construction quality, mass separation, and camera without copying their pixels into a different subject.",
  "category": {
    "id": "enemy-mob-32",
    "version": "0.1.0"
  },
  "style": {
    "id": "assembler-inspired-v2",
    "version": "0.1.0"
  },
  "producer": {
    "application": "Antigravity with Aseprite Pro MCP",
    "model": "Gemini 3.6 High",
    "sessionId": null
  },
  "artifacts": {
    "source": {
      "path": "revisions/r001/source.aseprite",
      "sha256": "19ab2e64802d8f731e7514c7e904acfd7f8f40314c6bb3f9592b5bfb83cafa03"
    },
    "sheet": {
      "path": "revisions/r001/sheet.png",
      "sha256": "85f86bb07cc4b665479f794b811ddba655b01412521fdbb1a2cd0448798a0264"
    },
    "thumbnail": {
      "path": "revisions/r001/thumbnail.png",
      "sha256": "fe525d878c6509975fee8e393f31fa86ddc1ebc23887d16b5c11ef5cde4ae26d"
    }
  },
  "sheet": {
    "cellWidth": 32,
    "cellHeight": 32,
    "columns": 10,
    "rows": 4,
    "width": 320,
    "height": 128
  },
  "directions": [
    "down",
    "left",
    "right",
    "up"
  ],
  "animations": [
    {
      "id": "idle",
      "startColumn": 0,
      "frames": 2,
      "durationMs": 400,
      "playback": "loop"
    },
    {
      "id": "walk",
      "startColumn": 2,
      "frames": 4,
      "durationMs": 150,
      "playback": "loop"
    },
    {
      "id": "attack",
      "startColumn": 6,
      "frames": 4,
      "durationMs": 120,
      "playback": "once"
    }
  ],
  "validationReportPath": "revisions/r001/validation.json",
  "batchId": null
}
