{
  "kind": "revision",
  "schemaVersion": "1.0.0",
  "assetId": "enemy-mob-32-tombmoth-swarm",
  "id": "r001",
  "parentRevisionId": null,
  "createdAt": "2026-08-01T12:39:33.000Z",
  "request": "Read and follow the project documentation.\n\nPromptinator entry ID: prompt-0096-tombmoth-swarm\nPrompt formula: structured-v2\nRequired style profile: assembler-inspired-v2@0.1.0\nRequired style guide: styles/assembler-inspired-v2/STYLE_GUIDE.md\n\nCreate an enemy-mob-32 sprite named \"Tombmoth Swarm\".\n\n## Creative brief\n\n- Collection: Grave Lantern Covenant. Folkloric undead and graveyard spirits using candles, bells, old cloth, runes, mossy armor, and restrained spectral magic.\n- Core concept: A clustered flying enemy that separates into smaller formations while attacking.\n- Body and silhouette: Dense triangular cloud of large moths with several visible wing shapes.\n- Signature features: Skull-like wing markings, powder trails, and one pale central moth.\n- Palette and materials: Dust gray, muted lavender, cream, and powdery wings.\n- Movement personality: Drifting, reactive, and loosely coordinated.\n- Attack concept: Divides into two groups that fire crossing streams before merging again.\n- Directional details: The pale moth remains toward the swarm’s front-left edge.\n- Avoid: Featureless black cloud, tiny realistic insects, human skull imagery.\n\n## Interpretation rules\n\n- Left and right refer to the creature's own anatomical sides and must remain consistent in every direction.\n- Treat gameplay effects as motion intent: make the attack readable through body posing, and use the effects layer only where the category contract allows.\n- Hard-alpha and style-contract rules override words such as translucent, glowing, soft, or transparent in the creative brief.\n- Before drawing, choose and state one controlled body plan from the required style guide.\n- Build and inspect the four idle directions under one camera and ground plane before expanding the animation timeline.\n- Use only the required style profile's master palette and contour rule.",
  "category": {
    "id": "enemy-mob-32",
    "version": "0.1.0"
  },
  "style": {
    "id": "assembler-inspired-v2",
    "version": "0.1.0"
  },
  "producer": {
    "application": "Antigravity with Aseprite Pro MCP",
    "model": "Gemini 3.6 High",
    "sessionId": null
  },
  "artifacts": {
    "source": {
      "path": "revisions/r001/source.aseprite",
      "sha256": "2dce708968c6d11e7d360893a7c7003c72d7508ad576c9d99e67c2e8f1bde24d"
    },
    "sheet": {
      "path": "revisions/r001/sheet.png",
      "sha256": "6f85e26a2f6d22f1da7be3b8d0985c80f130b1ece472bb63f53331b039066383"
    },
    "thumbnail": {
      "path": "revisions/r001/thumbnail.png",
      "sha256": "5cce9857e784c78e47a9d59b0d36e2d668a98e424160d8d43db71478623d02a3"
    }
  },
  "sheet": {
    "cellWidth": 32,
    "cellHeight": 32,
    "columns": 10,
    "rows": 4,
    "width": 320,
    "height": 128
  },
  "directions": [
    "down",
    "left",
    "right",
    "up"
  ],
  "animations": [
    {
      "id": "idle",
      "startColumn": 0,
      "frames": 2,
      "durationMs": 400,
      "playback": "loop"
    },
    {
      "id": "walk",
      "startColumn": 2,
      "frames": 4,
      "durationMs": 150,
      "playback": "loop"
    },
    {
      "id": "attack",
      "startColumn": 6,
      "frames": 4,
      "durationMs": 120,
      "playback": "once"
    }
  ],
  "validationReportPath": "revisions/r001/validation.json",
  "batchId": null
}
