{
  "kind": "revision",
  "schemaVersion": "1.0.0",
  "assetId": "enemy-mob-32-coffin-nail-imp",
  "id": "r001",
  "parentRevisionId": null,
  "createdAt": "2026-08-03T00:01:50.000Z",
  "request": "Read and follow the project documentation.\n\nPromptinator entry ID: prompt-0319-coffin-nail-imp\nPrompt formula: structured-v2\nRequired style profile: assembler-inspired-v2@0.1.0\nRequired style guide: styles/assembler-inspired-v2/STYLE_GUIDE.md\n\nCreate an enemy-mob-32 sprite named \"Coffin-Nail Imp\".\n\n## Creative brief\n\n- Collection: Gravebell Procession. Stylized undead attendants from forgotten cemeteries, using bells, candles, bones, ash, shrouds, and solemn ceremonial patterns rather than gore.\n- Core concept: A small nuisance attacker that hammers nails into delayed projectile traps.\n- Body and silhouette: Hunched goblin-like undead with long arms, broad feet, and a wooden mallet.\n- Signature features: Nail bundle backpack, coffin-plank mask, and iron-capped fingers.\n- Palette and materials: Weathered wood, gray-green cloth, black iron, and bone white.\n- Movement personality: Busy, furtive, and maliciously playful.\n- Attack concept: Plants one oversized nail into the ground; after three visible pulses, it fires four short bone splinters diagonally.\n- Directional details: The mallet is held in the left hand.\n- Avoid: Demonic horns, graphic corpse features, realistic tiny nails.\n\n## Interpretation rules\n\n- Left and right refer to the creature's own anatomical sides and must remain consistent in every direction.\n- Treat gameplay effects as motion intent: make the attack readable through body posing, and use the effects layer only where the category contract allows.\n- Hard-alpha and style-contract rules override words such as translucent, glowing, soft, or transparent in the creative brief.\n- Before drawing, choose and state one controlled body plan from the required style guide.\n- Build and inspect the four idle directions under one camera and ground plane before expanding the animation timeline.\n- Use only the required style profile's master palette and contour rule.\n- Use a recognition budget of exactly one dominant silhouette anchor plus one secondary identifying feature; the dominant anchor must remain recognizable at native 1x in all four idle directions.\n- Thin, spectral, floating, or winged subjects still need a solid readable center mass; wings and trailing effects remain secondary to it.\n- Keep a humanoid's key weapon or tool visibly separated from the torso in front and back views. For plant or construct concepts, separate the head or core from its supports instead of merging everything into one chunky mass.\n- Do not let a tiny face, eye, or detail carry the whole concept. Before timeline expansion, verify the subject, defining feature, and head or focal cluster all read at 1x.\n- Derive prop visibility per row before drawing: facing down places the creature's left side on the viewer's right; facing up places it on the viewer's left; the left-facing profile shows the creature's own left flank; the right-facing profile shows its right flank. State which asymmetric props are visible in each of the four rows and keep far-flank props hidden.\n- State each row's on-screen attack direction before animating: thrown or projected effects travel toward that row's facing (down toward the cell bottom, up toward the top, left and right toward their edges), stay at least 2 pixels inside every cell edge, and resolve into a recovery pose rather than freezing mid-flight.\n- Before drawing, open and study every promoted example sheet listed in styles/assembler-inspired-v2/examples.json at native 1x and nearest-neighbor 4x; match their construction quality, mass separation, and camera without copying their pixels into a different subject.",
  "category": {
    "id": "enemy-mob-32",
    "version": "0.1.0"
  },
  "style": {
    "id": "assembler-inspired-v2",
    "version": "0.1.0"
  },
  "producer": {
    "application": "Antigravity with Aseprite Pro MCP",
    "model": "Gemini 3.6 High",
    "sessionId": null
  },
  "artifacts": {
    "source": {
      "path": "revisions/r001/source.aseprite",
      "sha256": "c9c3a24775aa5a650d3071ca680f3a2fad7d8791298f5715f5ff4dc97555cc62"
    },
    "sheet": {
      "path": "revisions/r001/sheet.png",
      "sha256": "dda83c48a01c8a95d0f4ae601b6dabefbef32a4542f7787496b20a7537da3579"
    },
    "thumbnail": {
      "path": "revisions/r001/thumbnail.png",
      "sha256": "9cb7bfbf516dc87c77ef023858a9bce9142253b830c6dc3621e84292b85df4b2"
    }
  },
  "sheet": {
    "cellWidth": 32,
    "cellHeight": 32,
    "columns": 10,
    "rows": 4,
    "width": 320,
    "height": 128
  },
  "directions": [
    "down",
    "left",
    "right",
    "up"
  ],
  "animations": [
    {
      "id": "idle",
      "startColumn": 0,
      "frames": 2,
      "durationMs": 400,
      "playback": "loop"
    },
    {
      "id": "walk",
      "startColumn": 2,
      "frames": 4,
      "durationMs": 150,
      "playback": "loop"
    },
    {
      "id": "attack",
      "startColumn": 6,
      "frames": 4,
      "durationMs": 120,
      "playback": "once"
    }
  ],
  "validationReportPath": "revisions/r001/validation.json",
  "batchId": null
}
