{
  "kind": "revision",
  "schemaVersion": "1.0.0",
  "assetId": "enemy-mob-32-frostbite-weasel",
  "id": "r002",
  "parentRevisionId": "r001",
  "createdAt": "2026-08-02T14:07:45.111Z",
  "request": "Below current motion floors in the weakest direction: idle changes 26px beyond translation (floor 6) and walk 0px (floor 15 on two frames). Rebuild idle and walk with anatomy motion - planted feet, moving limbs or masses - per checklist section 4. Also give the attack readable body anticipation and release instead of effects-only frames; keep ground contact planted (no whole-body bob).",
  "category": {
    "id": "enemy-mob-32",
    "version": "0.1.0"
  },
  "style": {
    "id": "assembler-inspired-v2",
    "version": "0.1.0"
  },
  "producer": {
    "application": "Antigravity with Aseprite Pro MCP",
    "model": "Gemini 3.6 High",
    "sessionId": null
  },
  "artifacts": {
    "source": {
      "path": "revisions/r002/source.aseprite",
      "sha256": "27edd184080e0982a4633e58c3d928b0e67e4a5977a4f7a01e647cdb3710b7b4"
    },
    "sheet": {
      "path": "revisions/r002/sheet.png",
      "sha256": "c71c6203615a6f4d9fe82eaf7dd4049a847c5d5f167226af1384d1c1aa71fc61"
    },
    "thumbnail": {
      "path": "revisions/r002/thumbnail.png",
      "sha256": "7a9644fde2a46a94f3fca39fd273c40fb764b161a1a73b46087355efef2ccca6"
    }
  },
  "sheet": {
    "cellWidth": 32,
    "cellHeight": 32,
    "columns": 10,
    "rows": 4,
    "width": 320,
    "height": 128
  },
  "directions": [
    "down",
    "left",
    "right",
    "up"
  ],
  "animations": [
    {
      "id": "idle",
      "startColumn": 0,
      "frames": 2,
      "durationMs": 400,
      "playback": "loop"
    },
    {
      "id": "walk",
      "startColumn": 2,
      "frames": 4,
      "durationMs": 150,
      "playback": "loop"
    },
    {
      "id": "attack",
      "startColumn": 6,
      "frames": 4,
      "durationMs": 120,
      "playback": "once"
    }
  ],
  "validationReportPath": "revisions/r002/validation.json",
  "batchId": null
}
