{
  "kind": "revision",
  "schemaVersion": "1.0.0",
  "assetId": "enemy-mob-32-kelp-banner-guard",
  "id": "r001",
  "parentRevisionId": null,
  "createdAt": "2026-08-02T23:53:12.000Z",
  "request": "Read and follow the project documentation.\n\nPromptinator entry ID: prompt-0312-kelp-banner-guard\nPrompt formula: structured-v2\nRequired style profile: assembler-inspired-v2@0.1.0\nRequired style guide: styles/assembler-inspired-v2/STYLE_GUIDE.md\n\nCreate an enemy-mob-32 sprite named \"Kelp Banner Guard\".\n\n## Creative brief\n\n- Collection: Sunken Dynasty. Guardians and creatures from a flooded coastal kingdom, combining weathered bronze, coral, pearls, kelp, shells, and tidal formations.\n- Core concept: A support soldier whose banner creates moving lines of tidal projectiles.\n- Body and silhouette: Broad armored guardian holding a tall standard, short sword, and square shoulder plates.\n- Signature features: Flowing kelp banner, shell helmet, and barnacle-coated boots.\n- Palette and materials: Dark bronze, kelp green, faded blue, and pale shell.\n- Movement personality: Formal, steady, and protective.\n- Attack concept: Sweeps the banner from one side to the other, generating a matching row of water bolts that travels across the battlefield.\n- Directional details: The banner pole is carried in the left hand.\n- Avoid: Cloth national flag, pristine knight, projectiles detached from the banner motion.\n\n## Interpretation rules\n\n- Left and right refer to the creature's own anatomical sides and must remain consistent in every direction.\n- Treat gameplay effects as motion intent: make the attack readable through body posing, and use the effects layer only where the category contract allows.\n- Hard-alpha and style-contract rules override words such as translucent, glowing, soft, or transparent in the creative brief.\n- Before drawing, choose and state one controlled body plan from the required style guide.\n- Build and inspect the four idle directions under one camera and ground plane before expanding the animation timeline.\n- Use only the required style profile's master palette and contour rule.\n- Use a recognition budget of exactly one dominant silhouette anchor plus one secondary identifying feature; the dominant anchor must remain recognizable at native 1x in all four idle directions.\n- Thin, spectral, floating, or winged subjects still need a solid readable center mass; wings and trailing effects remain secondary to it.\n- Keep a humanoid's key weapon or tool visibly separated from the torso in front and back views. For plant or construct concepts, separate the head or core from its supports instead of merging everything into one chunky mass.\n- Do not let a tiny face, eye, or detail carry the whole concept. Before timeline expansion, verify the subject, defining feature, and head or focal cluster all read at 1x.\n- Derive prop visibility per row before drawing: facing down places the creature's left side on the viewer's right; facing up places it on the viewer's left; the left-facing profile shows the creature's own left flank; the right-facing profile shows its right flank. State which asymmetric props are visible in each of the four rows and keep far-flank props hidden.\n- State each row's on-screen attack direction before animating: thrown or projected effects travel toward that row's facing (down toward the cell bottom, up toward the top, left and right toward their edges), stay at least 2 pixels inside every cell edge, and resolve into a recovery pose rather than freezing mid-flight.\n- Before drawing, open and study every promoted example sheet listed in styles/assembler-inspired-v2/examples.json at native 1x and nearest-neighbor 4x; match their construction quality, mass separation, and camera without copying their pixels into a different subject.",
  "category": {
    "id": "enemy-mob-32",
    "version": "0.1.0"
  },
  "style": {
    "id": "assembler-inspired-v2",
    "version": "0.1.0"
  },
  "producer": {
    "application": "Antigravity with Aseprite Pro MCP",
    "model": "Gemini 3.6 High",
    "sessionId": null
  },
  "artifacts": {
    "source": {
      "path": "revisions/r001/source.aseprite",
      "sha256": "da42b4575900113cb7a935f77469302efefe3dd857fecd475596a589262eef12"
    },
    "sheet": {
      "path": "revisions/r001/sheet.png",
      "sha256": "07882eac61857df53153693f59da5598d71699e04f7237de785fa027aea15203"
    },
    "thumbnail": {
      "path": "revisions/r001/thumbnail.png",
      "sha256": "fe1d245197e24862d3574c0a92513affd9edefa4d7292de5e65f9e0901742cae"
    }
  },
  "sheet": {
    "cellWidth": 32,
    "cellHeight": 32,
    "columns": 10,
    "rows": 4,
    "width": 320,
    "height": 128
  },
  "directions": [
    "down",
    "left",
    "right",
    "up"
  ],
  "animations": [
    {
      "id": "idle",
      "startColumn": 0,
      "frames": 2,
      "durationMs": 400,
      "playback": "loop"
    },
    {
      "id": "walk",
      "startColumn": 2,
      "frames": 4,
      "durationMs": 150,
      "playback": "loop"
    },
    {
      "id": "attack",
      "startColumn": 6,
      "frames": 4,
      "durationMs": 120,
      "playback": "once"
    }
  ],
  "validationReportPath": "revisions/r001/validation.json",
  "batchId": null
}
